Customer Name,Address,Mobile,Pincode,Order ID,Item,Quantity,Width,Height,Length,Invoice Value,COD Amount if not Enter 0,State,City,"Additional Details(dangures Goods, Extra Care)",Weight,Total Amount,pickup_id,pickup_name,pickup_mobile,pickup_pincode,pickup_gstin,pickup_address,pickup_state,pickup_city,Order_Type
Moirangthem Rebika,"Thoubal kiyam siphai amureijam leikai, Thoubal",9366560825    ,795138,,Rose Gold Dial Womens Analog Watch,1,8,8,8,1699,1699,MN,Imphal,,0.102,1699,2054,,,,,,,,COD
Nong Anuradha,"Kakching Mayai Leikai Irum ningthou pareng, LIC",9366156672    ,795103,,Jacqueline Blue Dial Bracelet Women Watch,1,8,8,8,1899,1899,MN,Kakching,,0.102,1899,2054,,,,,,,,COD
Jenny Chanu,"Thangmeiband meisnam leikai opp thou ground mujhi leirak , Mujhi leirak",8787591080    ,795004,,Rose Gold Dial Womens Analog Watch,1,8,8,8,1699,1699,MN,Imphal ,,0.102,1699,2054,,,,,,,,COD
Linthoi Oinam,"Elangbam Leikai Youth Club (ELYC) Elangbam Leikai Keishamthong, Elangbam leikai near community hall",9612303591    ,795001,,Rose Gold Dial Womens Analog Watch,1,8,8,8,1699,1699,MN,Imphal,,0.102,1699,2054,,,,,,,,COD
Pooja Mistry,"Flat No 3 Block no B, Locknath Colony Opp govt polytechnic",9994478146    ,744104,,Rose Gold Dial Womens Analog Watch,1,8,8,8,1699,1699,AN,Port Blair,,0.102,1699,2054,,,,,,,,COD