Customer Name,Address,Mobile,Pincode,Order ID,Item,Quantity,Width,Height,Length,Invoice Value,COD Amount if not Enter 0,State,City,"Additional Details(dangures Goods, Extra Care)",Waight,Total Amount,pickup_id,pickup_name,pickup_mobile,pickup_pincode,pickup_gstin,pickup_address,pickup_state,pickup_city,Order_Type
Arun rajoriya,"village add,Banneri,near by-BhitArwar",8224038379,475220,,Kosmos Prime 2,1,8,8,8,1549,1549,MP,BhitArwar,,0.102,1549,2054,,,,,,,,COD
Rahul,Bellan bazar munger,9304606538,811201,,Kosmos Prime 2,1,8,8,8,1549,1549,BR,Munger,,0.102,1549,2054,,,,,,,,COD
Vinod,"Veliyil parambu House,Thathappilly. PoNorth Paravur, Chathurakkulam",8606015637,683520,,Kosmos Prime 2,1,8,8,8,1549,1549,KL,Eranakulam,,0.102,1549,2054,,,,,,,,COD
Yawar hussain mir,"Sallar pahalgam, Near ATM sallar pahalgam",6005284607,192402,,Kosmos Prime 2,1,8,8,8,1549,1549,JK,Anatnag,,0.102,1549,2054,,,,,,,,COD
Ravi rana,"B80 transport nagar, Jai deepak transport",9568285060,247001,,Kosmos Prime 2,1,8,8,8,1549,1549,UP,Saharanpur,,0.102,1549,2054,,,,,,,,COD
Sandeep Kumar,"house add-At+po-jhanjra near Panchayat bhavan, Panchayat bhawan",8986972114,851212,,Kosmos Prime 2,1,8,8,8,1549,1549,BR,Khagaria,,0.102,1549,2054,,,,,,,,COD
Avijit Das,"Near Rly Atp School,Chakla Itkhola, Das Villa",8622903588,743145,,Kosmos Prime 2,1,8,8,8,1549,1549,WB,Kanchrapara,,0.102,1549,2054,,,,,,,,COD
Mubashir,"Punnayill, Bpangadi kannamkulam mukilapidika",7025223250,676102,,Kosmos Prime 2,1,8,8,8,1549,1549,KL,Thirur,,0.102,1549,2054,,,,,,,,COD