Customer Name,Address,Mobile,Pincode,Order ID,Item,Quantity,Width,Height,Length,Invoice Value,COD Amount if not Enter 0,State,City,"Additional Details(dangures Goods, Extra Care)",Weight,Total Amount,pickup_id,pickup_name,pickup_mobile,pickup_pincode,pickup_gstin,pickup_address,pickup_state,pickup_city,Order_Type
Yogesh dadhich,"Govt.Sr.Sec.School, jaliya first ",9784870141,305901,,Nubia Alpha Foldable Smartwatch,1,20,15,8,1599,1599,RJ,Beawar ,,0.205,1599,4142,,,,,,,,COD
Sachin Ramdas vanve,At patan Shanghvi tal ashti dist beed,9325009188,414208,,Nubia Alpha Foldable Smartwatch,1,20,15,8,1599,1599,MH,Patan village,,0.205,1599,4142,,,,,,,,COD
Shrish Chandra Gupta,"104/64-A, Sisamau, Kanpur",9336123595,208012,,Nubia Alpha Foldable Smartwatch,1,20,15,8,1599,1599,UP,Kanpur,,0.205,1599,4142,,,,,,,,COD
Himanshu nigam,Ghaziabad Muradnagar Mohammad Pur dedha Shiv Mandir ke pass,9105862158,201206,,Nubia Alpha Foldable Smartwatch,1,20,15,8,1599,1599,UP,Ghaziabad,,0.205,1599,4142,,,,,,,,COD
Azhar Ismail War,Devine restorant near somo stand Magam ,9682347368,193221,,Nubia Alpha Foldable Smartwatch,1,20,15,8,1599,1599,J&K,Handwara,,0.205,1599,4142,,,,,,,,COD
Vikram Jeet Singh,New balmiki Nagar near dall mill chowni mohalla ludhiana,9815349501,141008,,Nubia Alpha Foldable Smartwatch,1,20,15,8,1599,1599,PB,Ludhiana,,0.205,1599,4142,,,,,,,,COD
