Customer Name,Address,Mobile,Pincode,Order ID,Item,Quantity,Width,Height,Length,Invoice Value,COD Amount if not Enter 0,State,City,"Additional Details(dangures Goods, Extra Care)",Weight,Total Amount,pickup_id,pickup_name,pickup_mobile,pickup_pincode,pickup_gstin,pickup_address,pickup_state,pickup_city,Order_Type
Hari KRISHNA,Port management board Phoenix bay,9531872060,744103,,Nubia Alpha Foldable Smartwatch,1,20,15,8,1599,1599,AN,South andaman Port Blair,,0.205,1599,4142,,,,,,,,COD
Tashi Pabin,"Forest colony, Mk niwas, Mk niwas",7638082409,791001,,Nubia Alpha Foldable Smartwatch,1,20,15,8,1599,1599,AP,Aalo,,0.205,1599,4142,,,,,,,,COD
Abdul Baqui,"604, Uncha kuwa,Haldiyon Ka Rasta Johari Bazar Jaipur- Raj",9772505282,302003,,Nubia Alpha Foldable Smartwatch,1,20,15,8,1599,1599,RJ,Jajpur,,0.205,1599,4142,,,,,,,,COD
Nadeem Shaikh,SAMTA NAGAR AHMADPUR DIST LATUR,9552276276,413515,,Nubia Alpha Foldable Smartwatch,1,20,15,8,1599,1599,MH,AHMADPUR,,0.205,1599,4142,,,,,,,,COD
Thajuddeen,Pllaram Panayal P.O ,7306085945,671318,,Nubia Alpha Foldable Smartwatch,1,20,15,8,1599,1599,TN,Periyatyaduka ,,0.205,1599,4142,,,,,,,,COD
Kuldip Singh,112 Dhabi Road Bhattu kalan,9812273767,125053,,Nubia Alpha Foldable Smartwatch,1,20,15,8,1599,1599,HR,Fatehabad,,0.205,1599,4142,,,,,,,,COD
