Customer Name,Address,Mobile,Pincode,Order ID,Item,Quantity,Width,Height,Length,Invoice Value,COD Amount if not Enter 0,State,City,"Additional Details(dangures Goods, Extra Care)",Waight,Total Amount,pickup_id,pickup_name,pickup_mobile,pickup_pincode,pickup_gstin,pickup_address,pickup_state,pickup_city,Order_Type
Sanjeev Kumar Singh,"All in one solution, Bangara bajar",7275620033,274702,,Kosmos Prime 2,1,8,8,8,1549,1549,AP,Bhatpar Rani,,0.102,1549,2054,,,,,,,,COD
Jana vamsi krishna,"Narayana reddy peta sri rajarajeswari temple near lalitha hair style shop near lalitha hair style shop main road, 524314",8309035612,524314,,Kosmos Prime 2,1,8,8,8,1549,1549,AP,Nellore,,0.102,1549,2054,,,,,,,,COD
rajesh,"19 new grah marg sailana, new grah marg sailana ratlam",8815868578,457550,,Kosmos Prime 2,1,8,8,8,1549,1549,MP,sailana,,0.102,1549,2054,,,,,,,,COD
A.Durai,"162 K. N. R Complex, 2nd Floor, 8th Street,, Gandhipuram",6391313814,641012,,Kosmos Prime 2,1,8,8,8,1549,1549,TN,Coimbatore,,0.102,1549,2054,,,,,,,,COD
Prabhakar,"Sivagangai (dk) thiruppathur (tk) devarambur 563, Vinayagar kovil",6383024537,630210,,Kosmos Prime 2,1,8,8,8,1549,1549,TN,Thiruppathur,,0.102,1549,2054,,,,,,,,COD
Devesh,Bhitawar,6263800413,475220,,Kosmos Prime 2,1,8,8,8,1549,1549,MP,Gwalior,,0.102,1549,2054,,,,,,,,COD