Customer Name,Address,Mobile,Pincode,Order ID,Item,Quantity,Width,Height,Length,Invoice Value,COD Amount if not Enter 0,State,City,"Additional Details(dangures Goods, Extra Care)",Weight,Total Amount,pickup_id,pickup_name,pickup_mobile,pickup_pincode,pickup_gstin,pickup_address,pickup_state,pickup_city,Order_Type
Rajendra meena,"232/233, hanuman path, Atlanstic tower, mufti",9782944039,302021,,Nubia Alpha Foldable Smartwatch,1,20,15,8,1599,1599,RJ,Jaipur,,0.205,1599,4142,,,,,,,,COD
Rahul padale,Pune old sangvi last bus stop Sai sneha park society C2 flat no 13,9764878290,411027,,Nubia Alpha Foldable Smartwatch,1,20,15,8,1599,1599,MH,Pune,,0.205,1599,4142,,,,,,,,COD
Dharampal,Padam nagar tifav road nahar par,9990086697,121002,,Nubia Alpha Foldable Smartwatch,1,20,15,8,1599,1599,HR,Harayana  padam  Nagar  tigav road  Nahar  par,,0.205,1599,4142,,,,,,,,COD
Shreemaan,"Venkatreddy Nagar, Ramanthapur",7075358649,500013,,Nubia Alpha Foldable Smartwatch,1,20,15,8,1599,1599,TN,Hyderabad,,0.205,1599,4142,,,,,,,,COD
Pranab kalita,11No Bamun goua   Dist=Tinsukia Assam    Pin code=786160,9957715152,786160,,Nubia Alpha Foldable Smartwatch,1,20,15,8,1599,1599,AS,Doom dooma,,0.205,1599,4142,,,,,,,,COD
Rajesh Bhatia,"Villa No -4106, Kalindi Hills, Sector-49",9891123459,121001,,Nubia Alpha Foldable Smartwatch,1,20,15,8,1599,1599,HR,Faridabad,,0.205,1599,4142,,,,,,,,COD
Yasir Amin Bhat,Gund I Maqsood chadoora Budgam,6006356468,191113,,Nubia Alpha Foldable Smartwatch,1,20,15,8,1599,1599,J&K,Srinagar,,0.205,1599,4142,,,,,,,,COD
