Customer Name,Address,Mobile,Pincode,Order ID,Item,Quantity,Width,Height,Length,Invoice Value,COD Amount if not Enter 0,State,City,"Additional Details(dangures Goods, Extra Care)",Weight,Total Amount,pickup_id,pickup_name,pickup_mobile,pickup_pincode,pickup_gstin,pickup_address,pickup_state,pickup_city,Order_Type
Y Siva sankar,"H.No 144, PRC Colony, Madanapalli Road, Pileru ",9346744361,517214,#4209,Luminated Car Stripe Light (All cars),1,22,4,18,999,999,AP,Pileru ,,0.4,999,4144,,,,,,,,COD
Sajith Sadasivan,"Sajith Bhavan, Kuzhimathicadu Po Thalavurkonam, Main Road, Near CHSS School",7591973269,691001,#4210,Luminated Car Stripe Light (All cars),3,22,4,18,999,999,KL,Kollam,,0.4,999,4144,,,,,,,,COD
Goldy Kumar,"H.No 205, galjia Mohalla, Bassi Pathana, Bus Stand",9872610438,140412,#4211,Luminated Car Stripe Light (All cars),1,22,4,18,999,999,PB,Bassi Pathana,,0.4,999,4144,,,,,,,,COD
Senthil Kumar,"H.NO 380, Avarampalayam Illango Nagar, Mensan Apartment, Near Gandhipuaram",7904435838,641001,#4213,Luminated Car Stripe Light (All cars),1,22,4,18,999,999,TN,Coimbatore,,0.4,999,4144,,,,,,,,COD
Ashish Rawat,"Harauni Station, Mohan Road Lucknow, Near Harauni Post Office ",7754026906,226401,#4215,Luminated Car Stripe Light (All cars),1,22,4,18,999,999,UP,Lucknow,,0.4,999,4144,,,,,,,,COD
Sankarsan Swain ,"Ward No. 18, Hinjilicut, Ankorada LB Margo",9437360634,761102,#24451938648198,Luminated Car Stripe Light (All cars),1,22,4,18,999,999,OR,Hinjili cut,,0.4,999,4144,,,,,,,,COD
Khan Amjad,Luhariya Bhilwara,9001816547,311403,#24455017332870,Luminated Car Stripe Light (All cars),1,22,4,18,999,999,RJ,Luhariya,,0.4,999,4144,,,,,,,,COD
Firdous Ahmad mir,"H.NO 56, Raiyyar khansb, Doodh papri Road, Dist. Budgam,",9149640419,191111,#4095,BUY NIGHT VISION SUNGLASS AND GET OTHER SUNGLASS FREE,2,22,4,18,999,999,JK,Budgam,,0.4,999,4144,,,,,,,,COD
Zuber Belim,"H.No 501, Zamzam Resident, New udhyapa, Opp. LB gate, Mahuva",8735800800,364290,#4156,Luminated Car Stripe Light (All cars),1,22,4,18,899,899,GJ,Mahuva,,0.4,899,4144,,,,,,,,COD
