Customer Name,Address,Mobile,Pincode,Order ID,Item,Quantity,Width,Height,Length,Invoice Value,COD Amount if not Enter 0,State,City,"Additional Details(dangures Goods, Extra Care)",Weight,Total Amount,pickup_id,pickup_name,pickup_mobile,pickup_pincode,pickup_gstin,pickup_address,pickup_state,pickup_city,Order_Type
Faizan Malik,near by governmet hospital,8433168252    ,247121,,Smart Watch Series 6 with Air Pods Pro,1,20,15,8,1649,1649,UP,Saharnpur,,0.205,1649,4136,,,,,,,,COD
atul Hake,near by bus stand,9604579646    ,414102,,Latest I-Watch Air Pods Pro Combo,1,20,15,8,1649,1649,MH,Ahmednagar,,0.205,1649,4136,,,,,,,,COD
Shahjeb  Khalil0007 ,near by Ajaad house,8755395647    ,250104,,Latest I-Watch Air Pods Pro Combo,1,20,15,8,1649,1649,UP,Kithor Rural,,0.205,1649,4136,,,,,,,,COD
KRISANU DEY,near by R BBM H SCHOOL,9641335171    ,721139,,Smart Watch Series 6 with Air Pods Pro,1,20,15,8,1649,1649,WB,Golegram,,0.205,1649,4136,,,,,,,,COD
RavalRajnikant Kirankumar,near by Bansal mall,9016947234    ,390021,,Smart Watch Series 6 with Air Pods Pro,1,20,15,8,1649,1649,GJ,Vadodara,,0.205,1649,4136,,,,,,,,COD
Aryan Pandit,dis . goutam buddh nagar,9871819971    ,201306,,Latest I-Watch Air Pods Pro Combo,1,20,15,8,3248,3248,UP,Greater Noida,,0.205,3248,4136,,,,,,,,COD
