Customer Name,Address,Mobile,Pincode,Order ID,Item,Quantity,Width,Height,Length,Invoice Value,COD Amount if not Enter 0,State,City,"Additional Details(dangures Goods, Extra Care)",Weight,Total Amount,pickup_id,pickup_name,pickup_mobile,pickup_pincode,pickup_gstin,pickup_address,pickup_state,pickup_city,Order_Type
John Sahil,"house no. 78 , land market habeb hauch",6006330339    ,190001,,Arrow Smart Watch with 360 Rotating HD Camera,1,20,15,8,1699,1699,JK,Lndia,,0.205,1699,4136,,,,,,,,COD
Bilkis Ara,"near by MS medicate sajraipora ,tangmarg",6005152656    ,193402,,Kospet Prime 2 Android 10 Smart Watch P22 Octa-core Phone Call 4G LTE 4GB+64GB Smartwatch & fitness Tracker,1,20,15,8,1699,1699,JK,Baramulla,,0.205,1699,4136,,,,,,,,COD
Akhil Kallare,near by Girija clinic hospital ,7899807214    ,574201,,Kospet Prime 2 Android 10 Smart Watch P22 Octa-core Phone Call 4G LTE 4GB+64GB Smartwatch & fitness Tracker,1,20,15,8,1699,1699,KA,Kallare,,0.205,1699,4136,,,,,,,,COD
Rakesh Saha,ward no 5 near by  hotel dollfin  infront of police point,9085538473    ,784115,,"Realme Smart Watch S Pro with 3.53 cm (1.39"") AMOLED Touchscreen, 14 Days Battery Life, SpO2 & Heart Rate Monitoring, 5ATM Water Resistance",1,20,15,8,1699,1699,AS,Kharupetia,,0.205,1699,4136,,,,,,,,COD
akash  chauhan,near by cod road shankar nagar,7080860905    ,211008,,"Realme Smart Watch S Pro with 3.53 cm (1.39"") AMOLED Touchscreen, 14 Days Battery Life, SpO2 & Heart Rate Monitoring, 5ATM Water Resistance",1,20,15,8,1699,1699,UP,Prayagraj,,0.205,1699,4136,,,,,,,,COD
